index,title,sentence,simplified,url,categories,simplification_type,avg_rating_original,avg_rating_simplified
108,Spéléothème,"Au moment de sa précipitation, la calcite (ou l'aragonite) formant les spéléothèmes ne contient en principe pas de thorium.","Au moment de sa précipitation, la calcite (ou l'aragonite) formant les spéléothèmes est dépourvue de thorium.",fr.wikipedia.org/wiki/Sp%C3%A9l%C3%A9oth%C3%A8me,"Article contenant un appel à traduction en anglais, Article contenant un appel à traduction en catalan, Article à référence souhaitée, Calcium (minéral), Carbonate (minéral), Minéralogie, Portail:Sciences/Articles liés, Portail:Sciences de la Terre et de l'Univers/Articles liés, Portail:Spéléologie/Articles liés, Spéléologie, Spéléothème",Propositions positives au lieu de négatives,3.8,2.4
109,Portrait d'Adeline Ravoux,Le portrait d'Adeline Ravoux est une peinture de l'artiste-peintre postimpressionniste hollandais Vincent Van Gogh réalisée en 1890.,Le portrait d'Adeline Ravoux est une peinture de Vincent Van Gogh réalisée en 1890.,fr.wikipedia.org/wiki/Portrait_d%27Adeline_Ravoux,"1890 en Europe, Article utilisant l'infobox Art, Article utilisant une Infobox, Page utilisant P1071, Page utilisant P135, Page utilisant P136, Page utilisant P1684, Page utilisant P179, Page utilisant des données de Wikidata à traduire de l'anglais, Portail:Années 1890/Articles liés, Portail:Arts/Articles liés, Portail:Europe/Articles liés, Portail:Histoire/Articles liés, Portail:Pays-Bas/Articles liés, Portail:Peinture/Articles liés, Portail:XIXe siècle/Articles liés, Portail:Époque contemporaine/Articles liés, Portrait de femme, Tableau de Vincent van Gogh, Tableau réalisé en 1890, Œuvre conservée dans une collection privée",Élimination des informations non essentielles,3.4,1.0
110,Pont du jardin des plantes de Grenoble,"Ils se rattachent lors de cette année anniversaire, à une série d’événements d’ordre culturel autour du béton, dont le plus emblématique est le lancement de la campagne de restauration de la Tour Perret.","Ils se rattachent lors de cette année anniversaire à une série d’événements d’ordre culturel autour du béton, notamment le lancement de la campagne de restauration de la Tour Perret.",fr.wikipedia.org/wiki/Pont_du_jardin_des_plantes_de_Grenoble,"Article géolocalisé sur Terre, Article utilisant le modèle Dictionnaires inactif, Article utilisant une Infobox, Page avec des cartes, Page sans coordonnées Wikidata, Page utilisant le modèle Autorité inactif, Page utilisant un modèle Bases inactif, Pont achevé en 1855, Portail:Auvergne-Rhône-Alpes/Articles liés, Portail:Bâtiment et travaux publics/Articles liés, Portail:Europe/Articles liés, Portail:France/Articles liés, Portail:France au XIXe siècle/Articles liés, Portail:Grenoble/Articles liés, Portail:Grenoble Métropole/Articles liés, Portail:Histoire/Articles liés, Portail:Isère/Articles liés, Portail:Technologies/Articles liés, Portail:XIXe siècle/Articles liés, Portail:Époque contemporaine/Articles liés, Wikipédia:ébauche Isère, Wikipédia:ébauche industrie",Transformation des propositions relatives,4.6,3.8
111,Rafle de maïs,L'eau dans laquelle on a fait bouillir des rafles de maïs contient des épaississants et peut être ajoutée à du potage ou transformée en gelée de maïs sucrée traditionnelle.,L'eau bouillie avec des rafles de maïs contient des épaississants et peut être ajoutée à du potage ou transformée en gelée de maïs sucrée traditionnelle.raditionnelle.,fr.wikipedia.org/wiki/Rafle_de_ma%C3%AFs,"Maïs, Morphologie des Poaceae, Portail:Agriculture et agronomie/Articles liés, Portail:Biologie/Articles liés, Portail:Botanique/Articles liés, Portail:Poaceae/Articles liés, Projet:Biologie/Pages liées, Résidu de culture, Wikipédia:ébauche agriculture",Transformation des propositions relatives,2.4,1.8
112,Tepe Fullol,"La richesse de la région provenait probablement de matériaux précieux extraits des montagnes voisines, en particulier du lapis lazuli de Badakshan, qui étaient largement commercialisés.","La richesse de la région venait probablement de matériaux précieux extraits des montagnes voisines, notamment du lapis lazuli de Badakshan.",fr.wikipedia.org/wiki/Tepe_Fullol,"Article géolocalisé en Afghanistan, Article utilisant une Infobox, Article à illustrer Site archéologique, Page avec des cartes, Page géolocalisée par Wikidata, Portail:Afghanistan/Articles liés, Portail:Archéologie/Articles liés, Portail:Asie/Articles liés, Portail:Sciences/Articles liés, Portail:Sciences humaines et sociales/Articles liés, Site archéologique en Afghanistan, Wikipédia:ébauche Afghanistan, Wikipédia:ébauche archéologie",Suppression des clauses complexes,3.0,2.2
113,White sponge nævus,Le white sponge nævus ou white sponge nevus (WSN) est une pathologie rare des muqueuses de la bouche (parfois atteinte plus rare encore des sites vaginaux et rectaux) transmissible de façon autosomique dominante.,"Le white sponge nævus est une pathologie rare des muqueuses de la bouche, transmissible de façon autosomique dominante.",fr.wikipedia.org/wiki/White_sponge_n%C3%A6vus,"Article utilisant une Infobox, Dermatologie, Page utilisant P1995, Portail:Biologie/Articles liés, Portail:Médecine/Articles liés, Portail:Sciences/Articles liés, Signe clinique en dermatologie, Terme médical, Wikipédia:ébauche médecine",Éviter les parenthèses et les incises,4.8,2.4
114,Streaming SIMD Extension 2,"Le SSSE3 ajoute 16 nouveaux opcodes qui incluent la permutation des octets dans un mot, la multiplication des nombres à virgule fixe 16 bits avec un arrondissement correct et des instructions d'accumulation dans un mot.","Le SSSE3 ajoute 16 nouveaux opcodes, incluant la permutation des octets dans un mot, la multiplication des nombres à virgule fixe 16 bits avec un arrondissement correct et des instructions d'accumulation.",fr.wikipedia.org/wiki/Streaming_SIMD_Extension_2,"Portail:Informatique/Articles liés, Portail:Sciences/Articles liés, Portail:Technologies/Articles liés, SIMD, Wikipédia:ébauche informatique",Transformation des propositions relatives,4.2,3.8
115,Pendule simple à résonance paramétrique,"Cette situation dite de Hill (théorie de la Lune), de Mathieu (balancelle) ou de Bloch (électron dans un métal) est fréquemment utilisée en optique, comme convertisseur de fréquences.","Cette situation dite de Hill, de Mathieu ou de Bloch est fréquemment utilisée en optique comme convertisseur de fréquences.",fr.wikipedia.org/wiki/Pendule_simple_%C3%A0_r%C3%A9sonance_param%C3%A9trique,"Pendule, Portail:Physique/Articles liés, Portail:Sciences/Articles liés, Wikipédia:ébauche mécanique",Éviter les parenthèses et les incises,4.4,2.4
116,Stade international d'Alep,"Les sièges sont tous de couleur bleu clair avec un petit nombre de sièges de couleur blanche placés dans la tribune Est pour former le mot ""Alep"" en arabe et en anglais.","Les sièges sont bleu clair avec quelques sièges blancs dans la tribune Est formant le mot ""Alep"" en arabe et en anglais.",fr.wikipedia.org/wiki/Stade_international_d%27Alep,"Alep, Article contenant un appel à traduction en polonais, Article géolocalisé en Syrie, Article utilisant l'infobox Stade, Article utilisant une Infobox, Page avec coordonnées similaires sur Wikidata, Page avec des cartes, Page avec des données de géolocalisation non prises en charge, Page utilisant P18, Page utilisant P3999, Portail:Architecture et urbanisme/Articles liés, Portail:Asie/Articles liés, Portail:Athlétisme/Articles liés, Portail:Football/Articles liés, Portail:Monde arabe/Articles liés, Portail:Moyen-Orient/Articles liés, Portail:Sport/Articles liés, Portail:Syrie/Articles liés, Stade d'athlétisme en Syrie, Stade de football en Syrie, Stade multifonction en Syrie, Stade portant le nom d'une ville, Wikipédia:ébauche Syrie, Wikipédia:ébauche stade de football, Équipement sportif achevé en 2007",Omission des mots redondants,3.2,2.0
117,Passeport portugais,"Le passeport portugais (en portugais : passaporte português) est un document de voyage international délivré aux ressortissants portugais, et qui peut aussi servir de preuve de la citoyenneté portugaise.","Le passeport portugais est un document de voyage international délivré aux ressortissants portugais, et qui peut aussi servir de preuve de la citoyenneté portugaise.",fr.wikipedia.org/wiki/Passeport_portugais,"Article avec une section vide ou incomplète, Article utilisant une Infobox, Passeport par pays, Politique étrangère du Portugal, Portail:Droit/Articles liés, Portail:Europe/Articles liés, Portail:Lusophonie/Articles liés, Portail:Portugal/Articles liés, Portail:Relations internationales/Articles liés, Portail:Société/Articles liés, Wikipédia:ébauche Portugal, Wikipédia:ébauche droit",Éviter les parenthèses et les incises,2.0,1.6
118,Mosquée du Cheikh Lotfallah,Il consiste en une salle de prière entièrement sous un dôme à laquelle on accède par un long couloir sombre en chicane menant à un grand portail.,"C'est une salle de prière sous un dôme, accessible par un couloir sombre menant à un grand portail.",fr.wikipedia.org/wiki/Mosqu%C3%A9e_du_Cheikh_Lotfallah,"Article géolocalisé en Iran, Article géolocalisé sur Terre, Article utilisant une Infobox, Arts de l'Islam, Ispahan, Mosquée en Iran, Page avec coordonnées similaires sur Wikidata, Page avec des cartes, Portail:Architecture et urbanisme/Articles liés, Portail:Asie/Articles liés, Portail:Iran et monde iranien/Articles liés, Portail:Islam/Articles liés, Portail:Moyen-Orient/Articles liés, Portail:Religions et croyances/Articles liés, Wikipédia:ébauche Iran, Wikipédia:ébauche mosquée",Transformation des propositions relatives,4.6,1.4
119,Journalisme économique,"Le journalisme d'affaires, bien que courant dans la plupart des pays industrialisés, joue un rôle très limité dans les pays du tiers-monde et en développement.",Le journalisme d'affaires joue un rôle très limité dans les pays du tiers-monde et en développement.,fr.wikipedia.org/wiki/Journalisme_%C3%A9conomique,"Article de Wikipédia avec notice d'autorité, Article utilisant le modèle Dictionnaires inactif, Journaliste économique, Métier du journalisme, Page utilisant un modèle Bases inactif, Portail:Journalisme/Articles liés, Portail:Médias/Articles liés, Portail:Société/Articles liés, Portail:Économie/Articles liés, Wikipédia:ébauche média, Wikipédia:ébauche économie, Économie",Suppression des clauses complexes,3.0,2.0
120,Quad Flat Package,Le boîtier rectangulaire (en plastique ou en céramique) est doté de broches de connexion sur ses 4 côtés (jusqu'à 200 broches).,Le boîtier rectangulaire en plastique ou céramique a des broches de connexion sur ses 4 côtés.,fr.wikipedia.org/wiki/Quad_Flat_Package,"Boîtier électronique, Portail:Sciences/Articles liés, Portail:Technologies/Articles liés, Portail:Électricité et électronique/Articles liés, Wikipédia:ébauche électronique",Éviter les parenthèses et les incises,3.4,1.6
121,Murailles de Cana,"Les murailles de la ville ont été construits par les Aldobrandeschi au début du XIIIe siècle, époque à laquelle la forteresse aldobrandesque a également été construite.","Au début du XIIIe siècle, les Aldobrandeschi ont construit les murailles de la ville et la forteresse aldobrandesque.",fr.wikipedia.org/wiki/Murailles_de_Cana,"Architecture militaire du Moyen Âge, Architecture militaire en Toscane, Article géolocalisé en Italie, Article utilisant une Infobox, Monument à Roccalbegna, Page avec coordonnées similaires sur Wikidata, Page avec des cartes, Portail:Architecture et urbanisme/Articles liés, Portail:Europe/Articles liés, Portail:Histoire/Articles liés, Portail:Histoire militaire/Articles liés, Portail:Italie/Articles liés, Portail:Toscane/Articles liés, Rempart en Italie, Wikipédia:ébauche Toscane, Wikipédia:ébauche architecture",Formes actives au lieu de passives,3.2,2.2
122,Corps de bâtiment,"Par « corps de métier » ou « corps d'état », voire « corps du bâtiment », on désigne l'activité professionnelle dans le secteur du bâtiment.",Le terme corps de métier désigne l'activité professionnelle dans le secteur du bâtiment.,fr.wikipedia.org/wiki/Corps_de_b%C3%A2timent,"Bâtiment, Portail:Architecture et urbanisme/Articles liés, Portail:Bâtiment et travaux publics/Articles liés, Portail:Technologies/Articles liés, Wikipédia:ébauche architecture, Wikipédia:ébauche construction, Élément de composition d'un bâtiment",Éviter les parenthèses et les incises,3.4,2.6
123,TX-0,"TX-0, pour Transistorized Experimental computer zero, surnommé affectueusement « Tixo », est le premier ordinateur terminal informatique à transistors.","TX-0, ou Transistorized Experimental computer zero, est le premier ordinateur terminal informatique à transistors.",fr.wikipedia.org/wiki/TX-0,"Ordinateur à transistors, Portail:Informatique/Articles liés, Portail:Sciences/Articles liés, Portail:Technologies/Articles liés, Wikipédia:ébauche informatique",Élimination des informations non essentielles,3.6,1.8
124,Cobija,"Lors des troubles de 2008 en Bolivie, une manifestation de paysans favorables au président Evo Morales est prise dans une embuscade tendue par des hommes armés à proximité de Cobija.","Lors des troubles de 2008 en Bolivie, une manifestation de paysans favorables à Evo Morales est prise dans une embuscade à proximité de Cobija.",fr.wikipedia.org/wiki/Cobija,"Article géolocalisé en Bolivie, Article géolocalisé sur Terre, Article utilisant une Infobox, Capitale de département en Bolivie, Département de Pando, Frontière entre la Bolivie et le Brésil, Page avec coordonnées similaires sur Wikidata, Page avec des cartes, Portail:Amérique/Articles liés, Portail:Amérique du Sud/Articles liés, Portail:Bolivie/Articles liés, Ville en Bolivie, Ville frontière, Wikipédia:ébauche localité bolivienne",Omission des mots redondants,2.25,2.0
125,Syndicalisme d'entreprise,Le syndicalisme d'entreprise est une manière d'organiser les travailleurs syndiqués d'un champ professionnel et géographique.,Le syndicalisme d'entreprise organise les travailleurs syndiqués d'un champ professionnel et géographique.,fr.wikipedia.org/wiki/Syndicalisme_d%27entreprise,"Portail:Syndicalisme/Articles liés, Syndicalisme",Élimination des informations non essentielles,2.6,1.2
126,Blueprint,"Le terme blueprint désigne, en anglais, une reproduction d'un plan détaillé, ce que l'on appelle en dessin technique un dessin de définition.","Le terme blueprint désigne, en anglais, une reproduction d'un plan détaillé, appelé en dessin technique un dessin de définition.",fr.wikipedia.org/wiki/Blueprint,"Imprimerie, Portail:Architecture et urbanisme/Articles liés, Portail:Génie mécanique/Articles liés, Portail:Sciences/Articles liés, Portail:Technologies/Articles liés",Transformation des propositions relatives,3.0,2.4
127,Taux de couverture,"Son évolution temporelle (par rapport à une base 2010) a la forme d'une courbe irrégulière en fortes ""dents de scie"", qui en moyenne décroit régulièrement de 1950 à 2015.","Son évolution temporelle a la forme d'une courbe irrégulière en fortes ""dents de scie"", qui en moyenne décroit régulièrement de 1950 à 2015.",fr.wikipedia.org/wiki/Taux_de_couverture,"Comptabilité nationale, Portail:Société/Articles liés, Portail:Économie/Articles liés, Wikipédia:ébauche économie",Éviter les parenthèses et les incises,3.8,2.6
128,Plaisir,"Dans ses fameux quatrains, il s'indigne que Dieu semble par ses textes religieux donner à l'homme des ordres tout en implantant en lui des désirs qui sont autant d'ordres contraires.","Dans ses quatrains, il s'indigne que Dieu semble donner à l'homme des ordres tout en implantant en lui des désirs contraires.",fr.wikipedia.org/wiki/Plaisir,"Article avec une section vide ou incomplète, Article à référence souhaitée, Bien-être, Catégorie Commons avec lien local identique sur Wikidata, Portail:Biologie/Articles liés, Portail:Neurosciences/Articles liés, Portail:Philosophie/Articles liés, Portail:Psychologie/Articles liés, Portail:Sciences/Articles liés, Portail:Sciences humaines et sociales/Articles liés, Portail:Société/Articles liés, Projet:Biologie/Pages liées, Wikipédia:ébauche neurosciences, Wikipédia:ébauche philosophie, Wikipédia:ébauche psychologie",Élimination des informations non essentielles,3.4,2.4
129,Dunkerque 2013,Dunkerque 2013 ou Dunkerque Capitale régionale de la culture 2013 est le nom de l'ensemble des festivités culturelles qui se déroulent à Dunkerque et dans son agglomération au cours de l'année 2013.,Dunkerque 2013 ou Dunkerque Capitale régionale de la culture 2013 est le nom des festivités culturelles qui se déroulent à Dunkerque et dans son agglomération en 2013.,fr.wikipedia.org/wiki/Dunkerque_2013,"2013 en France, Article manquant de références/Liste complète, Article manquant de références depuis mai 2013, Article utilisant une Infobox, Culture à Dunkerque, Nord-Pas-de-Calais, Page géolocalisable sans coordonnées paramétrées, Portail:Culture/Articles liés, Portail:Côte d'Opale/Articles liés, Portail:Dunkerque/Articles liés, Portail:Europe/Articles liés, Portail:Flandres/Articles liés, Portail:France/Articles liés, Portail:Hauts-de-France/Articles liés, Portail:Nord-Pas-de-Calais/Articles liés, Wikipédia:ébauche Nord-Pas-de-Calais, Wikipédia:ébauche culture",Élimination des informations non essentielles,3.6,3.2
130,Synchronisation d'Einstein,"Les procédures de synchronisation étant fondées sur la vitesse de la lumière, invariante par changement de référentiel inertiel, elles ne dépendent pas du référentiel choisi.","Les procédures de synchronisation étant fondées sur la vitesse de la lumière, invariante par changement de référentiel inertiel, sont indépendante du référentiel choisi.",fr.wikipedia.org/wiki/Synchronisation_d%27Einstein,"Page utilisant le modèle Citation avec un retour ligne, Portail:Physique/Articles liés, Portail:Sciences/Articles liés, Relativité, Temps",Propositions positives au lieu de négatives,4.8,4.8
131,Powiat d'Olesno,Le powiat d'Olesno (en polonais powiat oleski) est un powiat appartenant à la Voïvodie d'Opole dans le sud-ouest de la Pologne.,Le powiat d'Olesno est un powiat de la Voïvodie d'Opole dans le sud-ouest de la Pologne.,fr.wikipedia.org/wiki/Powiat_d%27Olesno,"Article géolocalisé en Pologne, Article utilisant une Infobox, Article à illustrer Subdivision administrative, Article à ne pas géolocaliser, Page avec des cartes, Page géolocalisée par Wikidata, Portail:Europe/Articles liés, Portail:Pologne/Articles liés, Powiat d'Olesno, Powiat dans la voïvodie d'Opole, Wikipédia:ébauche Pologne, Wikipédia:ébauche géographie",Éviter les parenthèses et les incises,4.6,2.8
132,Meng Huo,"Sa femme, Dame Zhurong, était elle aussi une guerrière émérite dont l'arme de prédilection était une sorte de boomerang à lames.","Sa femme, Dame Zhurong, était elle aussi une guerrière émérite avec une arme de prédilection, une sorte de boomerang à lames.",fr.wikipedia.org/wiki/Meng_Huo,"Article utilisant l'infobox Biographie2, Article utilisant l'infobox Biographie2 avec la charte militaire, Article utilisant une Infobox, Héros des Trois Royaumes, Page utilisant P106, Page utilisant P18, Page utilisant P19, Page utilisant P20, Page utilisant P3342, Portail:Asie/Articles liés, Portail:Biographie/Articles liés/Militaire, Portail:Littérature/Articles liés, Portail:Monde chinois/Articles liés, Wikipédia:Article biographique, Wikipédia:ébauche Chine, Wikipédia:ébauche histoire",Transformation des propositions relatives,3.2,2.8
133,Günter Fruhtrunk,"Ils se sont rencontrés chez Denise René, et Fruhtrunk s'inspire des sculptures monumentales de Di Teana pour créer sa création picturale de constructivisme, et il en fait un univers pictural rythmique et coloré.",Ils se sont rencontrés chez Denise René. Fruhtrunk s'inspire des sculptures monumentales de Di Teana pour créer sa création picturale de constructivisme. Il en fait un univers pictural rythmique et coloré.,fr.wikipedia.org/wiki/G%C3%BCnter_Fruhtrunk,"Article de Wikipédia avec notice d'autorité, Article utilisant l'infobox Artiste, Article utilisant une Infobox, Article à illustrer Artiste, Décès en décembre 1982, Décès à 59 ans, Décès à Munich, Naissance en mai 1923, Naissance à Munich, Page pointant vers des bases externes, Page pointant vers des bases relatives aux beaux-arts, Page utilisant P106, Page utilisant P19, Page utilisant P1988, Page utilisant P20, Page utilisant P2174, Page utilisant P245, Page utilisant P27, Page utilisant P2843, Page utilisant P3965, Page utilisant P4025, Page utilisant P4432, Page utilisant P4581, Page utilisant P569, Page utilisant P570, Page utilisant P650, Page utilisant P69, Page utilisant P8406, Peintre allemand du XXe siècle, Personnalité liée à un mouvement artistique d'avant-garde, Portail:Art contemporain/Articles liés, Portail:Arts/Articles liés, Portail:Biographie/Articles liés/Culture et arts, Portail:Biographie/Articles liés/Entreprises, Portail:Biographie/Articles liés/Peinture, Portail:Europe/Articles liés, Portail:France/Articles liés, Portail:Paris/Articles liés, Portail:Peinture/Articles liés, Portail:Île-de-France/Articles liés, Suicide en Allemagne, Wikipédia:Article biographique",Réduction de la longueur des phrases,4.6,2.6
134,Conrad Felixmüller,Conrad Felixmüller poursuit d'abord des études de musique (1911) avant d'étudier à l'Académie des Beaux-Arts de Dresde à l'automne 1912.,Conrad Felixmüller étudie la musique en 1911 avant d'étudier à l'Académie des Beaux-Arts de Dresde en 1912.,fr.wikipedia.org/wiki/Conrad_Felixm%C3%BCller,"Article avec une section vide ou incomplète, Article de Wikipédia avec notice d'autorité, Article utilisant l'infobox Artiste, Article utilisant une Infobox, Artiste de l'art dégénéré, Catégorie Commons avec lien local identique sur Wikidata, Culture sous le régime nazi, Décès en mars 1977, Décès à 79 ans, Décès à Berlin-Ouest, Naissance dans le royaume de Saxe, Naissance en mai 1897, Naissance à Dresde, Nouvelle objectivité, Page pointant vers des bases externes, Page pointant vers des bases relatives aux beaux-arts, Page pointant vers des bases relatives à l'audiovisuel, Page pointant vers des bases relatives à la musique, Page pointant vers des dictionnaires ou encyclopédies généralistes, Page utilisant P1038, Page utilisant P106, Page utilisant P1066, Page utilisant P119, Page utilisant P1284, Page utilisant P135, Page utilisant P1417, Page utilisant P1442, Page utilisant P1477, Page utilisant P1711, Page utilisant P19, Page utilisant P1953, Page utilisant P1988, Page utilisant P20, Page utilisant P2174, Page utilisant P2252, Page utilisant P2431, Page utilisant P245, Page utilisant P2639, Page utilisant P27, Page utilisant P2843, Page utilisant P3965, Page utilisant P40, Page utilisant P4342, Page utilisant P5019, Page utilisant P5368, Page utilisant P569, Page utilisant P570, Page utilisant P6295, Page utilisant P650, Page utilisant P69, Page utilisant P742, Page utilisant P7902, Page utilisant P7982, Page utilisant P8313, Page utilisant P8406, Peintre allemand du XXe siècle, Peintre expressionniste allemand, Personnalité du Parti communiste d'Allemagne, Portail:Allemagne/Articles liés, Portail:Arts/Articles liés, Portail:Biographie/Articles liés/Culture et arts, Portail:Biographie/Articles liés/Gravure, Portail:Biographie/Articles liés/Peinture, Portail:Communisme/Articles liés, Portail:Europe/Articles liés, Portail:Peinture/Articles liés, Portail:Politique/Articles liés, Wikipédia:Article biographique, Wikipédia:ébauche peintre allemand",Élimination des informations non essentielles,2.333333333333333,1.0
135,Filtre coupe-bande,Un filtre coupe-bande aussi appelé filtre réjecteur de bande ou filtre cloche est  un filtre empêchant le passage d'une partie des fréquences.,Un filtre coupe-bande ou filtre réjecteur de bande empêche le passage d'une partie des fréquences.,fr.wikipedia.org/wiki/Filtre_coupe-bande,"Circuit électrique, Filtre, Portail:Physique/Articles liés, Portail:Sciences/Articles liés, Portail:Technologies/Articles liés, Portail:Électricité et électronique/Articles liés, Wikipédia:ébauche électronique",Élimination des informations non essentielles,3.0,1.6
136,Refroidissement d'atomes par laser,Seule l'utilisation de lumière laser résonante permet de cumuler l'effet d'un cycle de fluorescence (absorption/émission spontanée) et d'utiliser efficacement ce phénomène pour agir sur un atome.,L'utilisation de lumière laser résonante permet de cumuler l'effet d'un cycle de fluorescence et de l'utiliser efficacement pour agir sur un atome.,fr.wikipedia.org/wiki/Refroidissement_d%27atomes_par_laser,"Article contenant un appel à traduction en anglais, Article à désacadémiser, Physique expérimentale, Physique quantique, Portail:Froid et climatisation/Articles liés, Portail:Optique/Articles liés, Portail:Physique/Articles liés, Portail:Sciences/Articles liés, Portail:Technologies/Articles liés, Utilisation du laser",Éviter les parenthèses et les incises,4.4,2.6
